{
    "$schema": "../schemas/leetTestsSchema.json",
    "LEET_ID": 383,
    "LEET_TITLE": "Ransom Note",
    "LEET_DESCRIPTION": "Given two strings ransomNote and magazine, return true if ransomNote can be constructed by using the letters from magazine and false otherwise.    Each letter in magazine can only be used once in ransomNote.",
    "LEET_CONSTRAINTS": "1 <= ransomNote.length, magazine.length <= 105\nransomNote and magazine consist of lowercase English letters.",
    "LEET_FUNC": "canConstruct",
    "LEET_RETURN": "bool",
    "LEET_PARAMS": "string ransomNote, string magazine"
}